{
  "schema_version": 1,
  "input_revision": "75647a481f21e4f1b4dbfde78d600be7b1206c9f7d18cb60183bdf8c58e68074",
  "variant_revision": "7a726ed7e81df1eeb83cd008b5c02e9b7f54038d714e6fa7f093419e1c6249e7",
  "generator": "scripts/generate-golden-candidates.mjs",
  "algorithm_version": "2",
  "promotion_rule": "双审一致，或双审不一致后完成裁决，才可改为 golden",
  "candidates": [
    {
      "alignment_id": "alignment:shanghan_lun:song:S0006+S0007:kangping:K0002",
      "target_edition": "kangping",
      "relation_type": "merge",
      "machine_confidence": 0.41,
      "difference_ratio": 0.218075,
      "source_text": "夫天布五行，以运万类；人禀五常，以有五脏。经络府俞，阴阳会通；玄冥幽微，变化难极。自非才高识妙，岂能探其理致哉！上古有神农、黄帝、歧伯、伯高、雷公、少俞、少师、仲文，中世有长桑、扁鹊，汉有公乘阳庆及仓公。下此以往，未之闻也。\n观今之医，不念思求经旨，以演其所知；各承家技，终始顺旧。省疾问病，务在口给；相对斯须，便处汤药。按寸不及尺，握手不及足；人迎、趺阳，三部不参；动数发息，不满五十。短期未知决诊，九候曾无仿佛。明堂阙庭，尽不见察，所谓窥管而已。夫能视死别生，实为难矣！",
      "target_text": "夫天布五行。以运万类。人禀五常。以有五脏。经络府俞。阴阳会通。玄冥幽微。变化难极。自非才高识妙。岂能探其理致哉。上古有神农。黄帝。歧伯。伯高。雷公。少俞。少师。仲文。中世有长桑。扁鹊。汉有公乘阳庆及仓公。下此以往。未之闻也。观今之医。不念思求经旨。以演其所知。各承家技。终始顺旧。省疾问病。务在口给。相对斯须。便处汤药。按寸不及尺。握手不及足。人迎趺阳。三部不参。动数发息。不满五十。短期未知决诊。九候曾无仿佛。明堂阙庭。尽不见察。所谓窥管而已。夫能视死别生。实为难矣。孔子云。生而知之者上。学则亚之。多闻博识。知之次也。余素尚方术。请事斯语。",
      "selection_reason": "merge",
      "review_state": "awaiting_first_review",
      "first_review": null,
      "second_review": null,
      "adjudication": null,
      "reviewed_relation_type": null,
      "golden_status": "candidate"
    },
    {
      "alignment_id": "alignment:shanghan_lun:song:S0112+S0113:kangping:K0030",
      "target_edition": "kangping",
      "relation_type": "merge",
      "machine_confidence": 0.43,
      "difference_ratio": 0.18408,
      "source_text": "夫阳盛阴虚，汗之则死，下之则愈；阳虚阴盛，汗之则愈，下之则死。夫如是，则神丹安可以误发？甘遂何可以妄攻？虚盛之治，相背千里，吉凶之机，应若影响，岂容易哉！况桂枝下咽，阳盛则毙；承气入胃，阴盛以亡，死生之要，在乎须臾，视身之尽，不暇计日。\n此阴阳虚实之交错，其候至微；发汗吐下之相反，其祸至速，而医术浅狭，懵然不知病源，为治乃误，使病者殒殁，自谓其分，至今冤魂塞于冥路，死尸盈于旷野，仁者鉴此，岂不痛欤！",
      "target_text": "夫阳盛阴虚。汗之则死。下之则愈。阳虚阴盛。汗之则愈。下之则死矣。夫如是。则神丹安可以误发。甘遂何可以妄攻。虚盛之治。相背千里。吉凶之机。应若影响。岂容易哉。况桂枝下咽。阳盛即毙。承气入胃。阴盛以凶。死生之要。在乎须臾。视身之尽。不暇计日。此阴阳虚实之交错。其候至微。发汗吐下之相反。其祸至速。而医术浅狭。懵然不知病源。为治乃误。使病者殒没。自谓其分。至今冤魂塞于冥路。死尸盈于旷野。仁者鉴此。岂不痛欤。",
      "selection_reason": "merge",
      "review_state": "awaiting_first_review",
      "first_review": null,
      "second_review": null,
      "adjudication": null,
      "reviewed_relation_type": null,
      "golden_status": "candidate"
    },
    {
      "alignment_id": "alignment:shanghan_lun:song:S0161+S0162:kangping:K0078",
      "target_edition": "kangping",
      "relation_type": "merge",
      "machine_confidence": 0.48,
      "difference_ratio": 0.142857,
      "source_text": "喘家作，桂枝汤加厚朴、杏子佳。\n凡服桂枝汤吐者，其后必吐脓血也。",
      "target_text": "喘家。作桂枝汤。加厚朴杏子佳。又服桂枝汤吐者。其后必吐脓血也。",
      "selection_reason": "merge",
      "review_state": "awaiting_first_review",
      "first_review": null,
      "second_review": null,
      "adjudication": null,
      "reviewed_relation_type": null,
      "golden_status": "candidate"
    },
    {
      "alignment_id": "alignment:shanghan_lun:song:S0170+S0171:kangping:K0089",
      "target_edition": "kangping",
      "relation_type": "merge",
      "machine_confidence": 0.4,
      "difference_ratio": 0.162791,
      "source_text": "太阳病，发热恶寒，热多寒少，脉微弱者，此无阳也，不可发汗，宜桂枝二越婢一汤。\n服桂枝汤，或下之，仍头项强痛，翕翕发热，无汗，心下满微痛，小便不利者，桂枝去桂加茯苓白术汤主之。",
      "target_text": "大阳病。发热恶寒。热多寒少。脉微弱者此无阳也。不可大发汗。宜桂枝二越婢一汤。服桂枝汤。或下之。仍头项强痛。翕翕发热。无汗心下满微痛。小便不利者。桂枝去桂加茯苓白术汤主之。",
      "selection_reason": "merge",
      "review_state": "awaiting_first_review",
      "first_review": null,
      "second_review": null,
      "adjudication": null,
      "reviewed_relation_type": null,
      "golden_status": "candidate"
    },
    {
      "alignment_id": "alignment:shanghan_lun:song:S0175+S0176:guilin:G0365",
      "target_edition": "guilin",
      "relation_type": "merge",
      "machine_confidence": 0.59,
      "difference_ratio": 0.142857,
      "source_text": "太阳与阳明合病者，必自下利，葛根汤主之。\n太阳与阳明合病，不下利，但呕者，葛根加半夏汤主之。",
      "target_text": "太阳与阳明合病者，必自下利，葛根汤主之；若不下利，但呕者，葛根加半夏汤主之。",
      "selection_reason": "merge",
      "review_state": "awaiting_first_review",
      "first_review": null,
      "second_review": null,
      "adjudication": null,
      "reviewed_relation_type": null,
      "golden_status": "candidate"
    },
    {
      "alignment_id": "alignment:shanghan_lun:song:S0179+S0180:kangping:K0100",
      "target_edition": "kangping",
      "relation_type": "merge",
      "machine_confidence": 0.33,
      "difference_ratio": 0.167883,
      "source_text": "太阳与阳明合病，喘而胸满者，不可下，宜麻黄汤。\n太阳病，十日已去，脉浮细而嗜卧者，外已解也。设胸满脇痛者，与小柴胡汤；脉但浮者，与麻黄汤。",
      "target_text": "大阳与阳明合病。喘而胸满者。不可下。宜麻黄汤。大阳病。十日已去。脉浮细而嗜卧者。外已解也。设胸满脇痛者。与小柴胡汤。脉但浮者。与麻黄汤。",
      "selection_reason": "merge",
      "review_state": "awaiting_first_review",
      "first_review": null,
      "second_review": null,
      "adjudication": null,
      "reviewed_relation_type": null,
      "golden_status": "candidate"
    },
    {
      "alignment_id": "alignment:shanghan_lun:song:S0182+S0183:kangping:K0103",
      "target_edition": "kangping",
      "relation_type": "merge",
      "machine_confidence": 0.33,
      "difference_ratio": 0.2125,
      "source_text": "伤寒脉浮缓，身不疼，但重，乍有轻时，无少阴证者，大青龙汤发之。\n伤寒表不解，心下有水气，干呕，发热而欬，或渴，或利，或噎，或小便不利，少腹满，或喘者，小青龙汤主之。",
      "target_text": "伤寒脉浮缓。身不疼。但重。乍有轻时无少阴症者。大青龙汤主之。伤寒表不解。心下有水气。干呕发热而欬。或渴。或利。或噎。小便不利。少腹满。或喘者。小青龙汤主之。",
      "selection_reason": "merge",
      "review_state": "awaiting_first_review",
      "first_review": null,
      "second_review": null,
      "adjudication": null,
      "reviewed_relation_type": null,
      "golden_status": "candidate"
    },
    {
      "alignment_id": "alignment:shanghan_lun:song:S0187+S0586:guilin:G0376",
      "target_edition": "guilin",
      "relation_type": "merge",
      "machine_confidence": 0.44,
      "difference_ratio": 0.325301,
      "source_text": "太阳病，外证未解，不可下也，下之为逆。欲解外者，宜桂枝汤。\n太阳病，外证未解，不可下，下之为逆。",
      "target_text": "太阳病，外证未解，不可下也，下之为逆；欲解外者，宜桂枝汤。（方见上卷）",
      "selection_reason": "merge",
      "review_state": "awaiting_first_review",
      "first_review": null,
      "second_review": null,
      "adjudication": null,
      "reviewed_relation_type": null,
      "golden_status": "candidate"
    },
    {
      "alignment_id": "alignment:shanghan_lun:song:S0187+S0586:kangping:K0109",
      "target_edition": "kangping",
      "relation_type": "merge",
      "machine_confidence": 0.36,
      "difference_ratio": 0.464789,
      "source_text": "太阳病，外证未解，不可下也，下之为逆。欲解外者，宜桂枝汤。\n太阳病，外证未解，不可下，下之为逆。",
      "target_text": "大阳病。外证未解。不可下。欲解外者。宜桂枝汤。",
      "selection_reason": "merge",
      "review_state": "awaiting_first_review",
      "first_review": null,
      "second_review": null,
      "adjudication": null,
      "reviewed_relation_type": null,
      "golden_status": "candidate"
    },
    {
      "alignment_id": "alignment:shanghan_lun:song:S0194+S0195:kangping:K0116",
      "target_edition": "kangping",
      "relation_type": "merge",
      "machine_confidence": 0.5,
      "difference_ratio": 0.1875,
      "source_text": "脉浮者，病在表，可发汗，宜麻黄汤。\n脉浮而数者，可发汗，宜麻黄汤。",
      "target_text": "脉浮者。病在表。可发汗。宜麻黄汤。脉浮而数。可发汗。宜麻黄汤。",
      "selection_reason": "merge",
      "review_state": "awaiting_first_review",
      "first_review": null,
      "second_review": null,
      "adjudication": null,
      "reviewed_relation_type": null,
      "golden_status": "candidate"
    },
    {
      "alignment_id": "alignment:shanghan_lun:song:S0271+S0272:kangping:K0207",
      "target_edition": "kangping",
      "relation_type": "merge",
      "machine_confidence": 0.32,
      "difference_ratio": 0.211765,
      "source_text": "问曰：病有结胸，有藏结，其状如何？按之痛，寸脉浮，关脉沈，名曰结胸也。\n何谓藏结？答曰：如结胸状，饮食如故，时时下利，寸脉浮，关脉小细沈紧，名曰藏结。舌上白胎滑者，难治。",
      "target_text": "问曰。病在结胸。有藏结。其状何如。答曰。按之痛。寸脉浮。关脉沈。名曰结胸也。何谓藏结。答曰。如结胸状。饮食如故。时时下利。寸脉浮关脉小细沈紧。名曰藏结。舌上白胎滑者难治。",
      "selection_reason": "low_confidence",
      "review_state": "awaiting_first_review",
      "first_review": null,
      "second_review": null,
      "adjudication": null,
      "reviewed_relation_type": null,
      "golden_status": "candidate"
    },
    {
      "alignment_id": "alignment:shanghan_lun:song:S0419:kangping:K0376",
      "target_edition": "kangping",
      "relation_type": "approximate",
      "machine_confidence": 0.32,
      "difference_ratio": 0.527273,
      "source_text": "太阴病，脉浮者，可发汗，宜桂枝汤。",
      "target_text": "大阴病。脉浮者。少可发汗宜桂枝汤。自利不渴者。属大阴。藏有寒故也。当温之。注",
      "selection_reason": "low_confidence",
      "review_state": "awaiting_first_review",
      "first_review": null,
      "second_review": null,
      "adjudication": null,
      "reviewed_relation_type": null,
      "golden_status": "candidate"
    },
    {
      "alignment_id": "alignment:shanghan_lun:song:S0096:kangping:K0008",
      "target_edition": "kangping",
      "relation_type": "approximate",
      "machine_confidence": 0.33,
      "difference_ratio": 0.586538,
      "source_text": "夫欲候知四时正气为病，及时行疫气之法，皆当按斗历占之。九月霜降节后，宜渐寒，向冬大寒，至正月雨水节后，宜解也。所以谓之雨水者，以冰雪解而为雨水故也。至惊蛰二月节后，气渐和暖，向夏大热，至秋便凉。",
      "target_text": "夫欲候知四时正气为病。及时行疫气之法。皆当按斗历占之。九月霜降节后。宜渐寒。向冬大寒。至正月雨水节后。宜解也。所以谓之雨水者。以冰解而为雨水故也。至惊蛰二月节后。气渐和暖。向夏大热。至秋便凉。从霜降以后。至春分以前寒冽。凡有触冒霜露。体中寒即病者。谓之伤寒也。九月十月。寒气尚微。为病则轻。十一月十二月。寒冽已严。为病则重。正月二月。寒渐将解。为病亦轻。此以冬时不调。适有伤寒之人。即为病也。冬有非节之暖者。名曰冬温。冬温之毒。与伤寒大异。冬温复有先后。更相重沓。亦有轻重。为治不同。证如后章。从立春节后。其中无暴大寒。又不冰雪。而有人壮热为病者。此属春时阳气。发于冬时伏寒。变为温病。从春分以后。至秋分节前。天有暴寒者。皆为时行寒疫也。",
      "selection_reason": "low_confidence",
      "review_state": "awaiting_first_review",
      "first_review": null,
      "second_review": null,
      "adjudication": null,
      "reviewed_relation_type": null,
      "golden_status": "candidate"
    },
    {
      "alignment_id": "alignment:shanghan_lun:song:S0133:guilin:G0803",
      "target_edition": "guilin",
      "relation_type": "approximate",
      "machine_confidence": 0.33,
      "difference_ratio": 0.449275,
      "source_text": "病身热足寒，颈项强急，恶寒，时头热面赤，目脉赤，独头面摇，卒口噤，背反张者，痓病也。",
      "target_text": "病者身热足寒，颈项强急，恶寒，时头热，面赤目赤，独头动摇，卒口噤，背反张者，痉病也。若发其汗，寒湿相得，其表益虚，则恶寒甚，发其汗已，其脉如蛇，暴脉长大者，为欲解；其脉如故，及伏弦者，为未解。",
      "selection_reason": "low_confidence",